"First-gen students inducted into first class of UNC's Tri Alpha Honors Society chapter","Emily Shih","University","2020/11","https://www.dailytarheel.com/article/2020/11/university-tri-alpha-honors-society-1109"
"UNC junior curates and sells vintage clothes, sparking school pride","Chelsea Ramsey","University","2020/11","https://www.dailytarheel.com/article/2020/11/university-tar-heel-throwback-profile"
"Heel Talk: BOG members' political contributions show conservative ties","Evely Forte Praveena Somasundaram","University","2020/11","https://www.dailytarheel.com/article/2020/11/university-heel-talk-28"
"'Monster under my bed': Students share the impact of ICE — and what UNC can do","Isabella Sherk","University","2020/11","https://www.dailytarheel.com/article/2020/11/university-ice-impact-event-1102"
"'This is our business': COVID-19 is changing research, courses at Gillings School","Kate Carroll","University","2020/11","https://www.dailytarheel.com/article/2020/11/university-gillings-applications-changes"
"After 197 years, no person of color or female professor named Secretary of the Faculty","Heidi Pérez-Moreno","University","2020/11","https://www.dailytarheel.com/article/2020/11/secretary-of-the-faculty-term"
"Three years later, Naval ROTC students celebrate receiving service assignments","Yunshu Yu","University","2020/11","https://www.dailytarheel.com/article/2020/11/university-rotc-assignments"
"UNC Faculty Council talks testing, budget and student survey responses","Sara Raja","University","2020/11","https://www.dailytarheel.com/article/2020/11/university-faculty-council-meeting-1109"
"University commission votes to begin renaming Graham Residence Hall","Lauren McCarthy","University","2020/11","https://www.dailytarheel.com/article/2020/11/university-commission-race-way-forward-1105"
"UNC to extend testing hours in the Union for students leaving for winter break","Hannah Rosenberger","University","2020/11","https://www.dailytarheel.com/article/2020/11/university-exit-testing-program"
"UNC organizations create events, resources to help students cope with election anxiety","Raymond Pang Cameron Myers Milne","University","2020/11","https://www.dailytarheel.com/article/2020/11/university-student-anxiety-election"
"UNC Graduate School to temporarily cut two fellowship programs for incoming students","Emma Lindsey","University","2020/11","https://www.dailytarheel.com/article/2020/11/university-royster-society-fellowships-pause"
"UNC Philosophy Department helps educate community via outreach program","Kaitlyn Dang","University","2020/11","https://www.dailytarheel.com/article/2020/11/university-philosophy-department-outreach"
"Tuition and Fee Advisory Task Force motions for two percent nonresident tuition increase","Claire Tynan","University","2020/11","https://www.dailytarheel.com/article/2020/11/university-tfat-1105"
"Campus Safety Commission members discuss improving active shooter response on campus","Charlotte Geier","University","2020/11","https://www.dailytarheel.com/article/2020/11/university-campus-safety-commission-1105"
"Students petition University to extend pass/fail declaration for fall semester","Anne Tate","University","2020/11","https://www.dailytarheel.com/article/2020/11/university-extend-pass-fail-deadline-petition"
"UNC lab partnership develops first COVID-19 treatment approved by FDA","Elena Tsai","University","2020/11","https://www.dailytarheel.com/article/2020/11/university-baric-lab-researchers"
"Campus and Community Advisory Committee discusses campus COVID-19 guidelines","Evan Castillo","University","2020/11","https://www.dailytarheel.com/article/2020/11/university-ccac-1103"
"Column: Is calling someone a 'bruh girl' problematic?","Madison Ward","University","2020/11","https://www.dailytarheel.com/article/2020/11/arts-bruh-girls"
"Faculty Executive Committee discusses COVID-19 guidelines for spring semester","William Christensen","University","2020/11","https://www.dailytarheel.com/article/2020/11/university-faculty-executive-committee-1102"
"'Smoke and mirrors': Employee report calls out UNC administration's 'toxic positivity'","Lauren McCarthy Hannah Rosenberger","University","2020/11","https://www.dailytarheel.com/article/2020/11/university-employee-forum-report"
"BeAM makerspace reopens in Murray Hall for all UNC students","Chelsea Ramsey","University","2020/11","https://www.dailytarheel.com/article/2020/11/university-beam-space-reopened"
"Some professors give students Election Day off to encourage voting","Greta Travaglia","University","2020/11","https://www.dailytarheel.com/article/2020/11/university-classes-canceled-election-day-1103"
"Heel Talk 27: Voter trends impacting the election","Evely Forte Praveena Somasundaram","University","2020/11","https://www.dailytarheel.com/article/2020/11/heel-talk-27"
"'So much at stake': Students prepare for Election Day","Jennifer Tran","University","2020/11","https://www.dailytarheel.com/article/2020/11/university-student-election-day-plans"
"Students, faculty react to UNC's latest plans for the spring semester","Lauren Cook","University","2020/11","https://www.dailytarheel.com/article/2020/11/university-spring-semester-student-reactions"
"'Possible but difficult': Students, instructors manage the struggles of Zoom classes","Sara Raja","University","2020/11","https://www.dailytarheel.com/article/2020/11/university-zoom-struggles"
"UNC reports 'no evidence' of an armed individual at the Ambulatory Care Center Friday","Maddie Ellis","University","2020/10","https://www.dailytarheel.com/article/2020/10/breaking-armed"
"Weekly Quiz for the Well-Read News Whiz: Oct. 30","","University","2020/10","https://www.dailytarheel.com/article/2020/10/oct-30-news-quiz"
"Law, dentistry school deans discuss potential tuition increases at Task Force meeting","Emily Shih","University","2020/10","https://www.dailytarheel.com/article/2020/10/university-tfat-1028"
"Vice Provost for Enrollment Steve Farmer to leave UNC for new position at UVA","Charlotte Geier Tara Ghorpadkar","University","2020/10","https://www.dailytarheel.com/article/2020/10/university-steve-farmer-departure-1030"
"Hussman student project brings campus back to life, helps students reconnect","Macon Porterfield","University","2020/10","https://www.dailytarheel.com/article/2020/10/arts-reconnect-carolina"
"UNC System hosts series of town halls for feedback on race and equity","Emma Lindsey","University","2020/10","https://www.dailytarheel.com/article/2020/10/university-bog-racial-taskforce-1029"
"After exodus, spread of COVID-19 in dorms, students lack trust in Carolina Housing","Isabella Sherk","University","2020/10","https://www.dailytarheel.com/article/2020/10/university-regaining-student-trust"
"From road trips to internships, students plan their extended winter break","Delaney Maness","University","2020/10","https://www.dailytarheel.com/article/2020/10/university-students-long-winter-break"
"Campus & Community Advisory Committee talks University wellness days","Kelly Kendall","University","2020/10","https://www.dailytarheel.com/article/2020/10/university-community-advisory-committee-rundown-1028"
"'Nothing happening': Students share a day in the life on UNC's empty campus","Greta Travaglia","University","2020/10","https://www.dailytarheel.com/article/2020/10/university-day-in-the-life-1027"
"'Take care of yourself': UNC students look to apps for stress relief","Macon Porterfield","University","2020/10","https://www.dailytarheel.com/article/2020/10/arts-self-care-apps-1027"
"BOG member and Racial Equity Task Force Chairperson Darrell Allison resigns","Preston Fore","University","2020/10","https://www.dailytarheel.com/article/2020/10/university-darrell-allison-resignation"
"UNC Hussman School works to gather student input for spring plans","Chelsea Ramsey","University","2020/10","https://www.dailytarheel.com/article/2020/10/university-journalism-school-class-preference"
"UNC Board of Governors discuss equity and accessibility in higher education","Kaitlyn Boeckel","University","2020/10","https://www.dailytarheel.com/article/2020/10/university-bog-recap-1025"
"UNC deans and administrators advise graduate students against going abroad at panel","William Christensen","University","2020/10","https://www.dailytarheel.com/article/2020/10/university-international-grad-student-panel"
"New fraternity aims to create community for students with a passion for tech","Emily Shih","University","2020/10","https://www.dailytarheel.com/article/2020/10/university-tech-fraternity-1026"
"From Raleigh to Atlanta, students explore virtual classrooms across the country","Malak Dridi","University","2020/10","https://www.dailytarheel.com/article/2020/10/university-virtual-classroom"
"Subcommittee discusses increasing Campus Health fee to hire more Black counselors","Bronwyn Campbell","University","2020/10","https://www.dailytarheel.com/article/2020/10/university-sfas-meeting-rundown"
"Students look to sublease over winter break due to delayed spring semester start","Hannah Rosenberger","University","2020/10","https://www.dailytarheel.com/article/2020/10/university-winter-break-subleasing-1026"
"UNC professor awarded MacArthur Genius Grant for research on social mobility","Nayeli Jaramillo-Plata","University","2020/10","https://www.dailytarheel.com/article/2020/10/university-feature-cottom"
"UNC students experience anxiety as they await COVID-19 test results","Lauren McCarthy","University","2020/10","https://www.dailytarheel.com/article/2020/10/university-covid-text-anxiety"
"UNC to offer five modes of instruction, single-occupancy housing for spring semester","Anna Neil","University","2020/10","https://www.dailytarheel.com/article/2020/10/breaking-spring-update-1023"
"Weekly Quiz for the Well-Read News Whiz: Oct. 23","Henry Haney","University","2020/10","https://www.dailytarheel.com/article/2020/10/oct23-news-quiz"
"University leaders discuss independent COVID-19 testing system for upcoming semester","Charlotte Geier","University","2020/10","https://www.dailytarheel.com/article/2020/10/university-covid-testing-university-reliant"
"UNC lacks plans to remove white supremacist name from Morrison Residence Hall","Clay Morris","University","2020/10","https://www.dailytarheel.com/article/2020/10/university-morrison-renaming"
"UNC Libraries create delivery service for students away from campus","Emily Schmidt","University","2020/10","https://www.dailytarheel.com/article/2020/10/university-library-ship-books-1023"
"UNC students step up to work the polls for early voting and Election Day","Emma Nipp","University","2020/10","https://www.dailytarheel.com/article/2020/10/university-student-poll-workers-feature"
"University allows students to list pronouns in ConnectCarolina","Natalie Johnson","University","2020/10","https://www.dailytarheel.com/article/2020/10/university-pronouns-directory-1023"
"Behind the mask: Students share skin care tips for quarantine","Savannah Gunter","University","2020/10","https://www.dailytarheel.com/article/2020/10/arts-quarantine-skincare-routines"
"UNC community works to support child care needs in wake of inactive committee","Anne Tate","University","2020/10","https://www.dailytarheel.com/article/2020/10/university-looking-at-revival-of-defunct-child-care-advisory-committee"
"UNC crew leader for housekeeping services becomes first recipient of staff award","Kaitlyn Dang","University","2020/10","https://www.dailytarheel.com/article/2020/10/university-james-holman-feature"
"Carolina Housing announces new housing option, programming for rising sophomores","Emma Lindsey","University","2020/10","https://www.dailytarheel.com/article/2020/10/university-housing-update"
"Midnight classes, thousands of miles away: Living abroad during UNC's remote semester","Cynthia Dong","University","2020/10","https://www.dailytarheel.com/article/2020/10/university-international-student-experience"
"Pumpkin houses and DIY costumes: Students find ways to celebrate Halloween indoors","Taylor Molina","University","2020/10","https://www.dailytarheel.com/article/2020/10/arts-pumpkin-creations-1021"
"Employee Forum committee discusses COVID-19 survey and town hall","Cameron Myers Milne","University","2020/10","https://www.dailytarheel.com/article/2020/10/university-exec-employee-forum-committee"
"Campus & Community Advisory Committee plans recommendations for spring housing","Evan Castillo","University","2020/10","https://www.dailytarheel.com/article/2020/10/university-campus-community-advisory-rundown"
"Student club calls for divestment from fossil fuels, reinvestment into the community","Sara Raja","University","2020/10","https://www.dailytarheel.com/article/2020/10/university-feature-reinvest-club"
"Musical Empowerment bridges technological divide to teach local students","Ben Greer","University","2020/10","https://www.dailytarheel.com/article/2020/10/university-musical-empowerment-feature"
"‘World’s changing quickly’: UNC graduates face uncertain labor market","Evely Forte","University","2020/10","https://www.dailytarheel.com/article/2020/10/university-impact-recession-graduates"
"‘Don’t rock the boat’: UNC resident advisers grapple with media policy","Praveena Somasundaram","University","2020/10","https://www.dailytarheel.com/article/2020/10/university-housing-ras-first-amendment"
"Faculty Executive Committee members discuss plans for mass testing in spring","Isabella Sherk","University","2020/10","https://www.dailytarheel.com/article/2020/10/university-faculty-executive-committee-rundown-1020"
"Ida B. Wells Society for Investigative Reporting welcomes Rhema Bland as new director","Chelsea Ramsey","University","2020/10","https://www.dailytarheel.com/article/2020/10/university-feature-rhema-bland-1020"
"Faculty Welfare Committee discusses improving child care for UNC employees","William Christensen","University","2020/10","https://www.dailytarheel.com/article/2020/10/university-faculty-welfare-committee-rundown-1020"
"UNC's Digital Accessibility Office works to make virtual spaces usable for all","Emily Schmidt","University","2020/10","https://www.dailytarheel.com/article/2020/10/university-digital-accessibility-office"
"Heel Talk Episode 25: Fans are welcomed back to Kenan Stadium","","University","2020/10","https://www.dailytarheel.com/article/2020/10/university-heel-talk-episode-25"
"Kenan-Flagler Business School welcomes its latest class of undergraduates","Lauren McCarthy","University","2020/10","https://www.dailytarheel.com/article/2020/10/university-new-business-school-class"
"Judge denies UNC’s motion to dismiss allegations of violating Clean Air Act","Claire Tynan","University","2020/10","https://www.dailytarheel.com/article/2020/10/university-coal-plant-court-denial"
"Tuition and Fee Advisory Task Force discussed increased cost proposal for graduate programs","Emily Shih","University","2020/10","https://www.dailytarheel.com/article/2020/10/university-tuition-fee-advisory-taskforce-1016"
"CAPS director gives mental health advice for UNC students during a remote semester","Elena Tsai","University","2020/10","https://www.dailytarheel.com/article/2020/10/university-caps-director-qanda"
"UNC senior creates new program offering peer-based support for reintegrating students","Jennifer Tran","University","2020/10","https://www.dailytarheel.com/article/2020/10/university-tar-heel-navigators-1016"
"UNC graduates sponsor students' attendance to virtual LGBTQ+ journalism convention","Yunshu Yu","University","2020/10","https://www.dailytarheel.com/article/2020/10/university-nlgja-student-sponsoring-1016"
"Student activists discuss 'remnants of Silent Sam' at documentary screening","Anne Tate","University","2020/10","https://www.dailytarheel.com/article/2020/10/university-silence-sam-screening"
"UNC professors share the biggest challenges they face this remote semester","Kelly Kendall","University","2020/10","https://www.dailytarheel.com/article/2020/10/university-biggest-challenges-professors-5f88d9461da3c"
"Campus & Community Advisory Committee met to discuss spring COVID-19 testing policies","Evan Castillo","University","2020/10","https://www.dailytarheel.com/article/2020/10/university-campus-community-advisory-committee-1015"
"Advisory Committee: UNC hopes to announce spring semester plans within two weeks","Charlotte Geier","University","2020/10","https://www.dailytarheel.com/article/2020/10/university-advisory-committee-1015"
"How the Faculty Athletics Committee connects academics and athletics","Kaitlyn Dang","University","2020/10","https://www.dailytarheel.com/article/2020/10/university-fac-explainer-1015"
"Chapel Hill voters weigh ballot-casting options this election season","Heidi Pérez-Moreno","University","2020/10","https://www.dailytarheel.com/article/2020/10/university-student-voting-plans"
"FaceTime games and margaritas with mom: Celebrating 21st birthdays in quarantine","Rylee Parsons","University","2020/10","https://www.dailytarheel.com/article/2020/10/arts-21-birthdays-covid-1014"
"Mental Health Coalition issues list of demands to UNC leaders","Isabella Sherk","University","2020/10","https://www.dailytarheel.com/article/2020/10/university-mental-health-coalition-letter"
"New Hussman Career Peers program brings student voices to career services","Chelsea Ramsey","University","2020/10","https://www.dailytarheel.com/article/2020/10/university-hussman-career-peers-1013"
"Students become their own baristas in quarantine","Macon Porterfield","University","2020/10","https://www.dailytarheel.com/article/2020/10/arts-at-home-baristas-1013"
"Bye Chelsea boots, hello sweatpants: Fall fashion shifts in quarantine","Charity Cohen","University","2020/10","https://www.dailytarheel.com/article/2020/10/arts-fall-fashion-1013"
"Student Fee Advisory Subcommittee discusses two proposed student fee changes","Emma Lindsey","University","2020/10","https://www.dailytarheel.com/article/2020/10/university-sfas-meeting"
"'A leap into a life that is to come’: Class of 2025 looks ahead while applying to UNC","Cameron Myers Milne","University","2020/10","https://www.dailytarheel.com/article/2020/10/university-college-application-season"
"Students adjust to delayed spring registration date","Sara Raja","University","2020/10","https://www.dailytarheel.com/article/2020/10/university-new-spring-2021-calendar"
"New saliva-based test on campus brings more frequent, less sensitive results","Charlotte Geier","University","2020/10","https://www.dailytarheel.com/article/2020/10/university-new-covid-test-accuracy-1013"
"UNC suspends P2P fixed routes through December, switches to on-demand services","Lauren McCarthy","University","2020/10","https://www.dailytarheel.com/article/2020/10/university-p2p-changes"
"Here's why UNC's $3 billion endowment can't all be used for COVID-19 relief","Kate Carroll","University","2020/10","https://www.dailytarheel.com/article/2020/10/university-endowment-explainer"
"Student commission holds public meeting to express spring planning concerns","Emily Shih","University","2020/10","https://www.dailytarheel.com/article/2020/10/university-commission-campus-equality-meeting-recap"
"New donations bring Kenan-Flagler closer to doubling undergraduate enrollment","Maddie Ellis","University","2020/10","https://www.dailytarheel.com/article/2020/10/university-new-donor-1010"
"Carolina Indian Circle fights for University recognition of Indigenous Peoples Day","Anthony Howard","University","2020/10","https://www.dailytarheel.com/article/2020/10/university-ipd-petition1012"
"Kevin Guskiewicz formally installed as UNC's 12th chancellor","Elena Tsai","University","2020/10","https://www.dailytarheel.com/article/2020/10/university-chancellor-installation-1012"
"Campus Health has begun texting students weekly reminders for COVID-19 testing","Hannah Rosenberger","University","2020/10","https://www.dailytarheel.com/article/2020/10/university-new-testing-texts"
"UNC undergrads form Students for Rare club to raise awareness of rare diseases","Greta Travaglia","University","2020/10","https://www.dailytarheel.com/article/2020/10/university-students-for-rare-feature-1011"
"UNC student filmmaker named finalist in study abroad film festival","Dominick Ferrara","University","2020/10","https://www.dailytarheel.com/article/2020/10/arts-sparks-filmmaker-1011"
"UNC commission discusses University's historical narrative","Delaney Maness","University","2020/10","https://www.dailytarheel.com/article/2020/10/university-race-commission-meeting-1009"
"Students and faculty express concerns over one-day instruction pause","Yunshu Yu","University","2020/10","https://www.dailytarheel.com/article/2020/10/university-mental-health-pause-student-reactions"
"Hussman School of Journalism and Media welcomes newest class","Raymond Pang","University","2020/10","https://www.dailytarheel.com/article/2020/10/university-new-hussman-class"
"Buildings across campus change policies, open new study spots","Evan Castillo","University","2020/10","https://www.dailytarheel.com/article/2020/10/university-study-spaces"
"UNC professors adjust course projects to work virtually","William Christensen","University","2020/10","https://www.dailytarheel.com/article/2020/10/university-class-projects-during-covid"
"'Our runway isn't that long': Chancellor Guskiewicz talks spring planning process","Maddie Ellis","University","2020/10","https://www.dailytarheel.com/article/2020/10/university-chancellor-qanda-1008"
"First generation UNC students feel isolated during UNC’s virtual semester","Heidi Pérez-Moreno","University","2020/10","https://www.dailytarheel.com/article/2020/10/university-first-generation-students-feature"
"'Even for a day': Students plan Mental Health Day self care","Maggie Dunn","University","2020/10","https://www.dailytarheel.com/article/2020/10/arts-mental-health-day-1007"
"UNC schedules five wellness days during spring semester","Maddie Ellis","University","2020/10","https://www.dailytarheel.com/article/2020/10/breaking-spring-semester-1008"
"‘Carolina is in my blood’: UNC alumnus awarded 2020 Thomas Wolfe Prize","Kelly Kendall","University","2020/10","https://www.dailytarheel.com/article/2020/10/university-thomas-wolfe-award-feature-1008"
"Carolina Housing plans to only offer single rooms for the spring semester","Benjamin Greer","University","2020/10","https://www.dailytarheel.com/article/2020/10/university-carolina-housing-zoom-chat-1008"
"'Not going to stay silent': Collyn Smith advocates for an equitable UNC","Natalie Johnson","University","2020/10","https://www.dailytarheel.com/article/2020/10/university-collyn-smith-feature"
"School of Dentistry holds annual free clinic honoring Deah Barakat and Yusor Abu-Salha","Kyle Ingram","University","2020/10","https://www.dailytarheel.com/article/2020/10/university-deah-day-1007"
"Campus and Community Advisory Committee reaches two recommendations in third meeting","Anne Tate","University","2020/10","https://www.dailytarheel.com/article/2020/10/university-campus-community-advisory-committee"
"UNC graduate discusses history of the political divide in America during lecture event","Kaitlyn Dang","University","2020/10","https://www.dailytarheel.com/article/2020/10/university-hillard-gold-lecture"
"'Things are moving quickly' in planning for spring semester, chair of the faculty says","Brandon Yoo","University","2020/10","https://www.dailytarheel.com/article/2020/10/university-faculty-executive-committee"
"Students express concerns over impact of single-use items in UNC dining halls","pageone Charlotte Geier","University","2020/10","https://www.dailytarheel.com/article/2020/10/university-dining-halls-environmental-impact-1007"
"Master Plan update: UNC continues campus renovations despite COVID-19","Claire Tynan","University","2020/10","https://www.dailytarheel.com/article/2020/10/university-covid-impact-master-plan-faq"
"Heel Talk Episode 24: Student leaders look ahead to spring semester","Evely Forte Praveena Somasundaram Jennifer Tran","University","2020/10","https://www.dailytarheel.com/article/2020/10/university-heel-talk-episode-24"
"'A very significant voice on campus': Your guide to the Faculty Executive Committee","Chelsea Ramsey","University","2020/10","https://www.dailytarheel.com/article/2020/10/university-faculty-executive-committee-explainer-1006"
"Student commission seeks student input on planning for spring semester","Anthony Howard","University","2020/10","https://www.dailytarheel.com/article/2020/10/university-campus-equality-student-equity-survey"
"Student leaders continue the push for Election Day course accommodations","Emily Orland","University","2020/10","https://www.dailytarheel.com/article/2020/10/university-no-election-day-off-follow-up-1005"
"Music makes me lose control: Albums students can listen to front to back","Gabi Allen","University","2020/10","https://www.dailytarheel.com/article/2020/10/arts-albums-no-skips-1005"
"UNC asks faculty to pause classes for a mental health day following student petition","Greta Travaglia","University","2020/10","https://www.dailytarheel.com/article/2020/10/university-mental-health-day-off-petition"
"Ida B. Wells symposia kicks off six-part series on legacy of 19th century journalist","Emily Schmidt","University","2020/10","https://www.dailytarheel.com/article/2020/10/university-iba-b-wells-symposium-1004"
"'He was everything': Colleagues and former students reflect on Randall Kenan","Isabella Sherk","University","2020/10","https://www.dailytarheel.com/article/2020/10/university-remembering-randall-kenan"
"Carolina Union event space reservations to be available starting in November","Malak Dridi","University","2020/10","https://www.dailytarheel.com/article/2020/10/university-carolina-union-event-reservations"
"Faculty Athletics Committee discusses plans for spring semester","Lauren McCarthy","University","2020/10","https://www.dailytarheel.com/article/2020/10/university-faculty-athletics-committee-1001"
