"Patricia Rosenmeyer named director for the Carolina Center for Jewish Studies","Keerthana Gotur","University","2022/05","https://www.dailytarheel.com/article/2022/05/university-patricia-rosenmeyer-jewish-studies"
"Looking back on a year of good news, bad news and unanswered questions","Praveena Somasundaram","University","2022/05","https://www.dailytarheel.com/article/2022/05/university-ldoc-paper-dth-news-recap"
"Q&A: Chancellor Guskiewicz reflects as spring semester comes to a close","Praveena Somasundaram","University","2022/04","https://www.dailytarheel.com/article/2022/04/university-chancellor-guskiewicz-ldoc-qanda"
"Local sisters create South Asian clothing with hopes of bringing it to the mainstream","Annie Ham","University","2022/04","https://www.dailytarheel.com/article/2022/04/university-sani-sisters-feature"
"UNC students and alumni play in local indie rock band","Holly Adams","University","2022/04","https://www.dailytarheel.com/article/2022/04/university-lauds-band-feature"
"'A dream come true': Marching Tar Heels reflect on the season","Lauren Fichten","University","2022/04","https://www.dailytarheel.com/article/2022/04/university-band-feature"
"'He's given me meaning': UNC senior talks about his time as Rameses","Liv Reilly","University","2022/04","https://www.dailytarheel.com/article/2022/04/university-rameses-feature"
"UNC community celebrates South Asian festival of colors at Holi Moli","Lauren Lovitt","University","2022/04","https://www.dailytarheel.com/article/2022/04/university-holi-moli"
"UNC Vice Chancellor for Development David Routh to step down after Campaign for Carolina","Liv Reilly","University","2022/04","https://www.dailytarheel.com/article/2022/04/david-routh-breaking"
"UNC planning to remove campus tents after Commencement","Courtland Bartosik","University","2022/04","https://www.dailytarheel.com/article/2022/04/university-removing-tents"
"A look at COVID-19 at UNC this spring","Layna Hong","University","2022/04","https://www.dailytarheel.com/article/2022/04/university-covid-data-updated"
"'Don't take anything for granted': UNC seniors leave their signatures at Bell Tower","Celia Funderburk","University","2022/04","https://www.dailytarheel.com/article/2022/04/university-senior-belltower"
"Students react to UNC System waiving standardized testing admission requirement","Celia Funderburk","University","2022/04","https://www.dailytarheel.com/article/2022/04/university-waives-standardized-testing"
"UNC Faculty Executive Committee talks BA.2 variant, Hussman inquiry","Jennifer Tran","University","2022/04","https://www.dailytarheel.com/article/2022/04/university-fec-meeting-0418"
"Research shows significant inequities in UNC faculty salaries","Liv Reilly","University","2022/04","https://www.dailytarheel.com/article/2022/04/university-unc-faculty-pay-inequities"
"History commission talks University land acknowledgment","Emily Shih","University","2022/04","https://www.dailytarheel.com/article/2022/04/university-hrwf-meeting0418"
"Carolina Veterans Resource Center offers award to student veterans","Zoe Frederick","University","2022/04","https://www.dailytarheel.com/article/2022/04/university-boot-print-heel-print"
"IDEA Action Grant program funds seven new diversity, equity, inclusion projects","Eileen Foster","University","2022/04","https://www.dailytarheel.com/article/2022/04/university-libraries-idea-action-program"
"'A Visual Anthology of Me': graduate student Alex M. Sanchez wins art grant","Adele Morris","University","2022/04","https://www.dailytarheel.com/article/2022/04/university-arts-innovation-alex-mousan"
"UNC to launch new School of Data Science and Society in fall 2022","Aisha Baiocchi","University","2022/04","https://www.dailytarheel.com/article/2022/04/university-school-of-data-science"
"Ackland Art Museum debuts exhibit on artist Aaron Douglas, 'Modern Black Culture'","Cameron Shaw","University","2022/04","https://www.dailytarheel.com/article/2022/04/university-ackland-spring-exhibit"
"UNC artist receives climate art award for short film on humanity and the environment","Natalie McCormick","University","2022/04","https://www.dailytarheel.com/article/2022/04/university-alexa-velez-feature"
"Flying Silk performs traditional Chinese dance on UNC's campus","Lauren Lovitt","University","2022/04","https://www.dailytarheel.com/article/2022/04/university-flying-silk-dance-feature"
"'This is '1984'': UNC inquiry on Hussman emails has broader scope than previously known","Praveena Somasundaram","University","2022/04","https://www.dailytarheel.com/article/2022/04/university-unc-hussman-email-inquiry-faculty"
"Meet Bettina Shuford, UNC's associate vice chancellor for student engagement","Zoe Frederick","University","2022/04","https://www.dailytarheel.com/article/2022/04/university-bettina-shuford-feature"
"'Strength in numbers': Carolina Latinx Faculty Council holds first meeting","Annie Ham","University","2022/04","https://www.dailytarheel.com/article/2022/04/university-clc-faculty-council-meeting"
"Flo Milli performs for CUAB Jubilee 2022 at UNC","Lauren Lovitt","University","2022/04","https://www.dailytarheel.com/article/2022/04/university-jubilee-2022"
"Raina Lee awarded first June Yom Student Award by the UNC Asian American Center","Natalie McCormick","University","2022/04","https://www.dailytarheel.com/article/2022/04/university-aac-award-raina-lee"
"UNC faculty talks salary inequities, administrative leadership changes","Natalie Varma Brooke Elliott","University","2022/04","https://www.dailytarheel.com/article/2022/04/university-fec-meeting0404"
"'Grounded Growth': University hosts sixth annual Arts Everywhere Day","Lauren Fichten","University","2022/04","https://www.dailytarheel.com/article/2022/04/university-arts-everywhere-day-2022"
"UNC Board of Governors waives standardized testing requirement through fall 2024","Hannah Rosenberger","University","2022/04","https://www.dailytarheel.com/article/2022/04/university-bog-meeting0407"
"University Libraries endowment supports the Southern Historical Collection","Lauren Lovitt","University","2022/04","https://www.dailytarheel.com/article/2022/04/university-library-endowment"
"Hussman School's Curtis Media Center opens its doors","Adele Morris","University","2022/04","https://www.dailytarheel.com/article/2022/04/university-curtis-media-center-opening"
"University peer listening program aims to support student mental health","Alan Hunt","University","2022/04","https://www.dailytarheel.com/article/2022/04/university-lsn-mental-health"
"UNC Muslim Students Association celebrates First MET event","Adele Morris","University","2022/04","https://www.dailytarheel.com/article/2022/04/university-msa-met"
"Despite a national championship loss, Tar Heel fans keep the dream alive","Jade Neptune Holly Adams","University","2022/04","https://www.dailytarheel.com/article/2022/04/university-dean-dome-reactions"
"'I do not want this to end': LGBTQ+ AAPI students meet for community, friendship","Hannah Rosenberger","University","2022/04","https://www.dailytarheel.com/article/2022/04/university-lgbtq-asian-american-meetups-feature"
"Second cohort of AAC Fellows host in-person lectures","Ryan Koluch","University","2022/04","https://www.dailytarheel.com/article/2022/04/university-aac-fellows-program"
"The Sewing Circle offers space for the sapphic community on campus","Keerthana Gotur","University","2022/04","https://www.dailytarheel.com/article/2022/04/university-sewing-circle"
"'Somebody’s got to pinch me': Students in New Orleans react to NCAA championship","Eileen Foster","University","2022/04","https://www.dailytarheel.com/article/2022/04/university-championship-in-nola"
"'Prioritize our well being over our output': Campus Y elects 2022-23 co-presidents","Jennifer Tran","University","2022/04","https://www.dailytarheel.com/article/2022/04/university-campus-y-copresidents"
"LGBTQ Center 'imagines liberation' for Pride Week 2022","Celia Funderburk","University","2022/04","https://www.dailytarheel.com/article/2022/04/university-pride-imagine-liberation"
"(W)omxn of Worth returns to UNC with in-person spring conference","Layna Hong","University","2022/04","https://www.dailytarheel.com/article/2022/04/university-womxn-of-worth"
"New UNC student organization uplifts Tamil culture and language at UNC","Abby Pender","University","2022/04","https://www.dailytarheel.com/article/2022/04/university-unc-tamil-feature"
"UNC's PlayMakers Repertory Company performs ""A Wrinkle in Time""","Sofia Casini","University","2022/04","https://www.dailytarheel.com/article/2022/04/university-wrinkle-in-time-playmakers"
"Muslim Student Association celebrates Ramadan","Adele Morris","University","2022/04","https://www.dailytarheel.com/article/2022/04/university-msa-ramadan-celebration"
"'This is epic': UNC community watches Final Four victory at Dean E. Smith Center","Jade Neptune Layna Hong","University","2022/04","https://www.dailytarheel.com/article/2022/04/university-dean-dome-student-reactions"
"'Once-in-a-lifetime': UNC students stake out for spots to watch Final Four game","Sarah Choi","University","2022/03","https://www.dailytarheel.com/article/2022/03/city-sup-dogs-reservations-final-four"
"'Just take it all in': UNC students who won ticket lottery prepare for Final Four","Jade Neptune","University","2022/03","https://www.dailytarheel.com/article/2022/03/university-tarheels-go-nola"
"Tornado watch in effect for Chapel Hill and Carrboro","Allie Kelly","University","2022/03","https://www.dailytarheel.com/article/2022/03/university-tornado-watch-breaking"
"UNC Board of Trustees discusses tenure clock, NC Policy Collaboratory","Hannah Rosenberger","University","2022/03","https://www.dailytarheel.com/article/2022/03/university-bot-meeting0324"
"Carolina For The Kids hosts first in-person Dance Marathon since 2019","Simon Tan","University","2022/03","https://www.dailytarheel.com/article/2022/03/university-cftk-dance-marathon"
"Over 50 years later, federal government opens investigation on James Cates' murder","Susie Webb","University","2022/03","https://www.dailytarheel.com/article/2022/03/city-doj-opens-james-cates-case"
"University Librarian Elaine Westbrooks was 'right leader for the right time' at UNC","Praveena Somasundaram","University","2022/03","https://www.dailytarheel.com/article/2022/03/university-elaine-westbrooks-unc-university-librarian-leaving-profile"
"UNC Libraries hosts virtual sustainability-themed collection","Lauren Fichten","University","2022/03","https://www.dailytarheel.com/article/2022/03/university-library-sustainability-collection"
"Raul Reis looks forward to new role as dean of UNC's journalism school","Abby Pender","University","2022/03","https://www.dailytarheel.com/article/2022/03/university-raul-reis-feature"
"Research study focuses on impact of alcohol culture on UNC students of color","Eileen Foster","University","2022/03","https://www.dailytarheel.com/article/2022/03/university-color-of-drinking-unc-study"
"'I'm very proud of us': UNC students react to upcoming Final Four game","Natalie Varma","University","2022/03","https://www.dailytarheel.com/article/2022/03/university-final-four-reactions"
"'Garden for everybody': A look at the Coker Arboretum on UNC's campus","Celia Funderburk","University","2022/03","https://www.dailytarheel.com/article/2022/03/university-coker-arboretum-feature"
"'Definitely a big deal': Faculty adjust exam schedules to celebrate UNC men's basketball","Hannah Rosenberger","University","2022/03","https://www.dailytarheel.com/article/2022/03/university-moved-exams-game"
"'We will be inheriting the Earth': Community gathers for climate strike","Holly Adams","University","2022/03","https://www.dailytarheel.com/article/2022/03/university-climate-strike"
"UNC Board of Trustees finance committee talks all funds budget, campus renovations","Layna Hong","University","2022/03","https://www.dailytarheel.com/article/2022/03/university-bot-finance-0323"
"Carolina Collaborative for Resilience offers student coaching program","Hadley Chapman","University","2022/03","https://www.dailytarheel.com/article/2022/03/university-resilience-coach-program"
"'This is her time': UNC alumna to voice announcements for 94th Academy Awards","Valeria Cloës","University","2022/03","https://www.dailytarheel.com/article/2022/03/university-janora-mcduffie-feature"
"UNC professor prepares for space travel ahead of March 29 Blue Origin launch","Lauren Fichten","University","2022/03","https://www.dailytarheel.com/article/2022/03/university-jim-kitchen-feature"
"'This is really disrespectful': Display of 'Tarred Healing' photo story canceled","Jade Neptune","University","2022/03","https://www.dailytarheel.com/article/2022/03/university-tarred-healing-follow-up"
"Faculty Executive Committee discusses 'Tarred Healing' photo story, faculty salaries","Brianna Atkinson","University","2022/03","https://www.dailytarheel.com/article/2022/03/university-fec-meeting0321"
"History, Race and a Way Forward commission discusses upcoming building dedications","Madi Kirkman","University","2022/03","https://www.dailytarheel.com/article/2022/03/university-hrwf-meeting-0321"
"UPenn dean gives inaugural lecture in new series on racial equity","Jennifer Tran","University","2022/03","https://www.dailytarheel.com/article/2022/03/university-distinguished-lectureship"
"Meet Aliyah Griffith, first Black UNC student to get a marine sciences graduate degree","Celia Funderburk","University","2022/03","https://www.dailytarheel.com/article/2022/03/university-aliyah-griffith-feature"
"UNC students support art and sustainability in Chapel Hill-based studio","Annie Ham","University","2022/03","https://www.dailytarheel.com/article/2022/03/university-mad-griffin-studio"
"Postcard project aims to capture UNC staff's experiences during pandemic","Zoe Frederick","University","2022/03","https://www.dailytarheel.com/article/2022/03/university-pandemic-postcards"
"University hosts first-ever Carolina Engagement Week","Alan Hunt","University","2022/03","https://www.dailytarheel.com/article/2022/03/university-carolina-engagement-week"
"'I hope to empower': Meet music education lecturer LaSaundra Booth","Kelly Kendall","University","2022/03","https://www.dailytarheel.com/article/2022/03/university-lasaundra-booth-feature"
"Diversity committee discusses 'Tarred Healing' photo story, vice chancellor plagiarism","Zoe Frederick","University","2022/03","https://www.dailytarheel.com/article/2022/03/university-community-diversity-meeting0310"
"Faculty Council discusses salary inequities, recent vice chancellor resignation","Emily Shih","University","2022/03","https://www.dailytarheel.com/article/2022/03/university-faculty-council-meeting-0311"
"Emerson College's Raul Reis to be next Hussman School dean","Praveena Somasundaram","University","2022/03","https://www.dailytarheel.com/article/2022/03/university-hussman-school-dean-breaking"
"University names 2022 MLK Unsung Hero Award winners","Zoe Frederick","University","2022/03","https://www.dailytarheel.com/article/2022/03/university-unsung-hero-award"
"Terry Magnuson, UNC vice chancellor for research, resigns from role","Praveena Somasundaram","University","2022/03","https://www.dailytarheel.com/article/2022/03/university-terry-magnuson-research-resigns-from-position"
"Counsel fees add to UNC System losses in the Silent Sam settlements","Natalie Varma","University","2022/03","https://www.dailytarheel.com/article/2022/03/university-silent-sam-counsel-payments"
"UNC School of Government dean to step down at end of year","Liv Reilly","University","2022/03","https://www.dailytarheel.com/article/2022/03/university-gov-dean-stepping-down-breaking"
"UNC-Chapel Hill Ethics Bowl team competes at nationals","Holly Adams","University","2022/03","https://www.dailytarheel.com/article/2022/03/university-ethics-bowl-team"
"Panelists discuss importance of intersectionality in mental health at conference","Fiona Hasanaj Lauren Fichten","University","2022/03","https://www.dailytarheel.com/article/2022/03/university-intersectionality-mental-health-conference"
"FEC discusses masks, BOT relations and UNC's racial history at Monday meeting","Liv Reilly","University","2022/03","https://www.dailytarheel.com/article/2022/03/university-fec-meeting0307"
"Triangle community holds vigil to advocate for peace in Ukraine","Hannah Rosenberger","University","2022/03","https://www.dailytarheel.com/article/2022/03/university-franklin-ukraine-event"
"N.C. Collaboratory publishes report marking five year anniversary","Eileen Foster","University","2022/03","https://www.dailytarheel.com/article/2022/03/university-collaboratory-anniversary"
"Carolina Indian Circle holds first in-person powwow since pandemic","Adele Morris","University","2022/03","https://www.dailytarheel.com/article/2022/03/university-cic-powwow"
"University Librarian Elaine Westbrooks to depart UNC","Praveena Somasundaram","University","2022/03","https://www.dailytarheel.com/article/2022/03/university-unc-libraries-departure-elaine-westbrooks"
"UNC’s first seed library launches, offers community free planting supplies","Adele Morris","University","2022/03","https://www.dailytarheel.com/article/2022/03/university-seed-library-launch-party"
"'We are open to everybody': A look inside the UNC Music Library","Celia Funderburk","University","2022/03","https://www.dailytarheel.com/article/2022/03/university-music-library-feature"
"University to lift mask mandate beginning March 7","Allie Kelly Liv Reilly","University","2022/03","https://www.dailytarheel.com/article/2022/03/university-lifting-mask-mandate-breaking"
"UNC Heels Care Network hosts mental health seminars","Brooke Elliott","University","2022/03","https://www.dailytarheel.com/article/2022/03/university-mental-health-sessions1"
"'Tarred Healing' photo story on Black history at UNC pulled from display","Jade Neptune","University","2022/03","https://www.dailytarheel.com/article/2022/03/university-tarred-healing-photo-exhibit"
"Well Ride program offers UNC students free transportation to off-campus counseling","Nayeli Jaramillo-Plata","University","2022/03","https://www.dailytarheel.com/article/2022/03/donotpub-university-well-ride-program"
"UNC Board of Governors announces faculty public service award honorees","Allie Kelly","University","2022/03","https://www.dailytarheel.com/article/2022/03/university-bog-full-board-0224"
"'Pay it forward': Renée Alexander Craft celebrates Tanner Award recognition","Jennifer Tran","University","2022/03","https://www.dailytarheel.com/article/2022/03/university-renee-craft-feature"
"UNC campus pharmacies offer free naloxone kits","Zoe Frederick","University","2022/03","https://www.dailytarheel.com/article/2022/03/university-naloxone-free-distribution-unc-campus-pharmacy-utility"
"Carolina Latinx Center grows Leadership Alliance with UNC student groups","Layna Hong","University","2022/03","https://www.dailytarheel.com/article/2022/03/university-clc-student-leadership-alliance"
"UNC Institute of Marine Sciences celebrates its 75th anniversary","Holly Adams","University","2022/02","https://www.dailytarheel.com/article/2022/02/university-institute-of-marine-sciences-75-anniversary"
"UNC senior awarded honorable mention in North Carolina Writers’ Network contest","Adele Morris","University","2022/02","https://www.dailytarheel.com/article/2022/02/university-leticia-tuset-feature"
"Editorial: Where to find new spots to soak up the sun","Editorial Board","University","2022/02","https://www.dailytarheel.com/article/2022/02/opinion-study-spots-unc"
"UNC System announces mask-optional change, University to keep mandate following county policies","Allie Kelly","University","2022/02","https://www.dailytarheel.com/article/2022/02/university-mask-mandate-breaking-unc-system-masks-optional"
"UNC Figure Skating Club unites members' love for the ice","Courtland Bartosik","University","2022/02","https://www.dailytarheel.com/article/2022/02/university-figure-skating-club-feature"
"'Kind of a dream come true': Ackland Upstairs highlights N.C. Black Feminisms and more","Lauren Fichten","University","2022/02","https://www.dailytarheel.com/article/2022/02/university-ackland-upstairs-feb"
"History commission discusses land acknowledgment and Barbee Cemetery","Fiona Hasanaj","University","2022/02","https://www.dailytarheel.com/article/2022/02/university-hrwf-meeting0221"
"LaTosha Brown delivers 2022 MLK celebration keynote address at UNC","Hannah Rosenberger","University","2022/02","https://www.dailytarheel.com/article/2022/02/university-mlk-lecture-awards-ceremony"
"UNC research teams awarded $170 million in grant funding","Eileen Foster","University","2022/02","https://www.dailytarheel.com/article/2022/02/university-nutrition-research-advancement"
"UNC Outdoor Education Center debuts new trails on campus","Collin Tadlock","University","2022/02","https://www.dailytarheel.com/article/2022/02/university-oec-biking-trails"
"UNC researchers developing process to create stronger plastic material","Lauren Lovitt","University","2022/02","https://www.dailytarheel.com/article/2022/02/university-chemistry-new-material"
"UNC SILS researchers aim to create more equitable makerspaces","Natalie McCormick","University","2022/02","https://www.dailytarheel.com/article/2022/02/university-makerspace-vr-lab"
"Carolina Jump Rope Club offers competition and community","Celia Funderburk","University","2022/02","https://www.dailytarheel.com/article/2022/02/university-carolina-jump-rope-feature"
"'I love this team': Bhangra Elite wins first place at South Asian dance competition","Valeria Cloës","University","2022/02","https://www.dailytarheel.com/article/2022/02/university-bhangra-elite"
"'Talk pop-up books': UNC SILS library holds a collection of over 1,700 and counting","Annie Ham","University","2022/02","https://www.dailytarheel.com/article/2022/02/university-library-pop-up-books"
"Chancellor's committee meets to draft building renaming report for Board of Trustees","Brooke Elliott","University","2022/02","https://www.dailytarheel.com/article/2022/02/university-history-commission-resolution0217"
"Community reflects on UNC history in ""Race and Memory"" discussion event","Madi Kirkman","University","2022/02","https://www.dailytarheel.com/article/2022/02/university-race-and-memory"
"'Our stories being told by us': CLC and University Libraries launch book collection","Zoe Frederick","University","2022/02","https://www.dailytarheel.com/article/2022/02/university-afro-latinx-stories"
"Student sustainability group working to build solar panel resources on campus buildings","Alan Hunt","University","2022/02","https://www.dailytarheel.com/article/2022/02/university-morrison-solar-panels"
"UNC GPSG President-elect Theodore Nollert wants to build graduate student community","Layna Hong","University","2022/02","https://www.dailytarheel.com/article/2022/02/university-gpsg-election-winner"
"UNC Faculty Executive, Advisory committees propose faculty governance changes","Liv Reilly","University","2022/02","https://www.dailytarheel.com/article/2022/02/university-fec-advisory-meeting0214"
"Theodore Nollert elected as Graduate and Professional student body president","Allie Kelly","University","2022/02","https://www.dailytarheel.com/article/2022/02/university-gpsg-election-results"
"Meet Li-ling Hsiao, UNC associate professor in Asian and Middle Eastern studies","Aisha Baiocchi","University","2022/02","https://www.dailytarheel.com/article/2022/02/university-li-ling-hsiao-feature"
"Diversity committee discusses department hiring, faculty mentoring resources","Brianna Atkinson","University","2022/02","https://www.dailytarheel.com/article/2022/02/university-community-diversity-meeting-0214"
"Ackland Art Museum hosts global cult cinema film forum at the Varsity Theatre","Hadley Chapman","University","2022/02","https://www.dailytarheel.com/article/2022/02/donotpub-university-ackland-film-forum"
"Meet the candidates for UNC Graduate and Professional Student Government president","Natalie Varma","University","2022/02","https://www.dailytarheel.com/article/2022/02/university-gpsg-elections"
"Proposed renaming of UNC's Hamilton Hall after Pauli Murray still in progress","Madi Kirkman","University","2022/02","https://www.dailytarheel.com/article/2022/02/university-building-renaming-hamilton"
"Sharmila Udyavar named associate director of global education at UNC","Abby Pender","University","2022/02","https://www.dailytarheel.com/article/2022/02/university-ovpga-udyavar-feature"
"'They see value': Postdoctoral program supports faculty members of color","Hannah Rosenberger","University","2022/02","https://www.dailytarheel.com/article/2022/02/university-postdoctoral-faculty-diversity-program"
"Asian American Center to host mental health discussion","Kelly Kendall","University","2022/02","https://www.dailytarheel.com/article/2022/02/university-asian-american-mental-health"
"Faculty Council discusses new Heels Care Network, COVID-19 on campus","Emily Shih","University","2022/02","https://www.dailytarheel.com/article/2022/02/university-faculty-council0211"
"'Preserving the core of what makes you wonderful': Gillings welcomes new vice dean","Jade Neptune","University","2022/02","https://www.dailytarheel.com/article/2022/02/university-robert-smith-feature"
"Award-winning author Marcia Chatelain delivers 2022 Black History Month lecture","Brooke Elliott","University","2022/02","https://www.dailytarheel.com/article/2022/02/university-bhm-lecture-0209"
"Journalist and UNC alumnus Frank Bruni to be spring 2022 Commencement speaker","Allie Kelly","University","2022/02","https://www.dailytarheel.com/article/2022/02/university-frank-bruni-commencement-short"
"UNC launches new mental health initiative called 'Heels Care Network'","Natalie Varma","University","2022/02","https://www.dailytarheel.com/article/2022/02/university-heels-care-network"
