"First-years face burnout from a year of isolation as finals approach","Emily Shih","University","2021/04","https://www.dailytarheel.com/article/2021/04/university-mental-health-burnout"
"UNC junior Sam Zahn wins Truman Scholarship","Kaitlyn Dang","University","2021/04","https://www.dailytarheel.com/article/2021/04/university-samuel-zahn-profile"
"Editorial: Tips for a stress-free class registration","Editorial Board","University","2021/04","https://www.dailytarheel.com/article/2021/04/opinion-unc-class-registration-tips"
"UNC junior Paloma Ruiz becomes 51st recipient of the Goldwater Scholarship","Charlotte Geier","University","2021/04","https://www.dailytarheel.com/article/2021/04/university-paloma-armendariz-ruiz-feature"
"UNC Graduate School suspends GRE requirements for 2022 application cycle","Hannah Rosenberger","University","2021/04","https://www.dailytarheel.com/article/2021/04/university-admin-board-grad-school-0420"
"What to Watch: Oscars Edition","Guillermo Molero Madison Ward Ryan Phillips","University","2021/04","https://www.dailytarheel.com/article/2021/04/arts-oscars-top-five-must-watch"
"'Lacrosse is for everyone': Meet the co-host of ESPN's 'Sound On with Tari and Amari'","Isabella Reilly","University","2021/04","https://www.dailytarheel.com/article/2021/04/university-amari-pollard-feature"
"One year of love during the pandemic","Lauren McCarthy","University","2021/04","https://www.dailytarheel.com/article/2021/04/university-pandemic-dating"
"Campaign for Carolina ahead of schedule as it nears $4.25 billion fundraising goal","Max Hazerjian","University","2021/04","https://www.dailytarheel.com/article/2021/04/university-campaign-for-carolina-funds"
"Orange County Historical Museum will take you on a date, 20th century style","Hannah Kaufman","University","2021/04","https://www.dailytarheel.com/article/2021/04/arts-date-night-exhibit"
"Two students start the first OCD support group at UNC","Kelly Kendall","University","2021/04","https://www.dailytarheel.com/article/2021/04/university-ocd-support-group-unc-chapel-hill"
"UNC System not planning to require COVID-19 vaccines for students returning this fall","Isabella Reilly","University","2021/04","https://www.dailytarheel.com/article/2021/04/university-faculty-council-0416"
"Digital time capsules: UNC Story Archive preserves oral histories for future generations","Brianna Atkinson","University","2021/04","https://www.dailytarheel.com/article/2021/04/university-library-archival-project"
"Column: The case for American studies","Abbas Hasan","University","2021/04","https://www.dailytarheel.com/article/2021/04/opinion-american-studies-unc"
"Editorial: Sexual harassment and violence resources in Chapel Hill","Editorial Board","University","2021/04","https://www.dailytarheel.com/article/2021/04/opinion-sexual-harassment-resources"
"Wanna Smash, Bro?: UNC students unwind with virtual tournaments","Mika Travis","University","2021/04","https://www.dailytarheel.com/article/2021/04/arts-want-to-smash"
"Who are the voting members on the UNC Board of Governors?","Will Melfi Rachel Crumpler","University","2021/04","https://www.dailytarheel.com/article/2021/04/unc-board-of-governors"
"CAPS addresses lack of AAPI representation at Mental Health Task Force meeting","Amy Xu","University","2021/04","https://www.dailytarheel.com/article/2021/04/university-mental-health-task-force-meeting-0415"
"Residents of Morrison Hall were without clean water for 48 hours","Cameron Myers Milne","University","2021/04","https://www.dailytarheel.com/article/2021/04/university-morrison-water-outage"
"UNC alumnus uses law experience to write second trial novel, 'You Have Your Way'","Rylee Parsons","University","2021/04","https://www.dailytarheel.com/article/2021/04/arts-you-have-your-way"
"Grammy-nominated band Steep Canyon Rangers reflects on UNC origins, self-produced album","Casey Meisel","University","2021/04","https://www.dailytarheel.com/article/2021/04/arts-steep-canyon-rangers"
"UNC doctoral student Rachel Woodul applies prior pandemic research to COVID-19","Grace Battle Thompson","University","2021/04","https://www.dailytarheel.com/article/2021/04/university-rachel-woodul-profile"
"UNC group to hold virtual art show to benefit Habitat for Humanity","Sara Raja","University","2021/04","https://www.dailytarheel.com/article/2021/04/arts-art-for-humanity-unc"
"Oscars Spotlight: 'Nomadland' is, far and away, this year’s best picture","Guillermo Molero","University","2021/04","https://www.dailytarheel.com/article/2021/04/arts-oscars-nomadland"
"Editorial: Edit Board's declassified roommate survival guide","Editorial Board","University","2021/04","https://www.dailytarheel.com/article/2021/04/opinion-roommate-tips"
"With over 50 buildings in severe condition, UNC's maintenance costs keep growing","Preston Fore","University","2021/04","https://www.dailytarheel.com/article/2021/04/university-deferred-maintenance-budget-crisis-buildings-safety"
"Meet the five new members of the UNC Board of Governors","Rachel Crumpler","University","2021/04","https://www.dailytarheel.com/article/2021/04/university-board-of-governors-appointment-politics-democrat"
"Oscars Spotlight: “Judas and the Black Messiah” is a thoughtful, emotional powerhouse","Guillermo Molero","University","2021/04","https://www.dailytarheel.com/article/2021/04/arts-oscars-judias-black-messiah"
"We talked with five UNC students about how they're redefining fashion this spring","Chloe Walker","University","2021/04","https://www.dailytarheel.com/article/2021/04/arts-spring-fashion"
"Crystal healing provides stepping stone for people looking to spirituality","Greta Travaglia","University","2021/04","https://www.dailytarheel.com/article/2021/04/arts-crystal-power"
"UNC celebrates LGBTQ+ community through its annual Pride Week Celebration","Chelsea Ramsey","University","2021/04","https://www.dailytarheel.com/article/2021/04/university-pride-week-lgbtq"
"Art Unblocked exhibit aims to amplify the voices of disabled artists in NC","Lily Chubb","University","2021/04","https://www.dailytarheel.com/article/2021/04/arts-art-unblocked"
"UNC and NCCU host symposium on promoting anti-racism in business","Samuel Garzon Amy Xu","University","2021/04","https://www.dailytarheel.com/article/2021/04/university-anti-racism-symposium"
"'Queen of disaster': star of disaster girl internet meme graduating from UNC","Lucy Smithwick","University","2021/04","https://www.dailytarheel.com/article/2021/04/zoe-roth-disaster-girl-meme-feature-unc"
"'It's an island': AAPI students share experiences studying in Hussman School","Brianna Atkinson","University","2021/04","https://www.dailytarheel.com/article/2021/04/university-journalism-school-aapi-resources-experience"
"'A kaleidoscope-like exploration of love': UNC student writes novel with D.C. fellowship","Hannah Rosenberger","University","2021/04","https://www.dailytarheel.com/article/2021/04/university-ananya-mallik-feature-book-student-author"
"Editorial: Gatekeeping won't solve the computer science department's issues","Editorial Board","University","2021/04","https://www.dailytarheel.com/article/2021/04/opinion-computer-science-problems"
"Faculty Executive Committee discusses fixed-term faculty, COVID-19 monitoring app","Chase Taylor","University","2021/04","https://www.dailytarheel.com/article/2021/04/university-fec-meeting-0412"
"Editorial: Addressing medical racism through pre-med education","Editorial Board","University","2021/04","https://www.dailytarheel.com/article/2021/04/opinion-pre-med-requirements-unc"
"Former DTH editor-in-chief to publish book about UNC academic-athletic scandal","Caroline Yaffa","University","2021/04","https://www.dailytarheel.com/article/2021/04/university-andy-thomason-book"
"Faculty Welfare Committee aims to improve caregiving resources for UNC faculty","Emma Lindsey","University","2021/04","https://www.dailytarheel.com/article/2021/04/university-faculty-welfare-committee-meeting-childcare"
"University seeks input from community as it renames campus buildings","Lauren McCarthy","University","2021/04","https://www.dailytarheel.com/article/2021/04/university-community-input-building-renaming"
"UNC launches initiative to help North Carolina counties post-pandemic — all 100 of them","Kennedy Rushing","University","2021/04","https://www.dailytarheel.com/article/2021/04/university-carolina-across-100"
"LISTEN: Reflecting on University jurisdiction of students in violation of campus community standards","Evely Forte Praveena Somasundaram","University","2021/04","https://www.dailytarheel.com/article/2021/04/university-heel-talk-episode-42"
"N.C. House bill would give UNC-System president power to cut salaries across the board","Preston Fore","University","2021/04","https://www.dailytarheel.com/article/2021/04/university-layoffs-unc-system-bill"
"UNC junior Benjamin Carter writes and produces first album","Noah Robert Houser","University","2021/04","https://www.dailytarheel.com/article/2021/04/arts-coming-out-of-it-album"
"'Never forget': UNC Hillel marks Holocaust Remembrance Day with stories of survival","Amy Xu","University","2021/04","https://www.dailytarheel.com/article/2021/04/university-unc-hillel-holocaust-survivors"
"UNC Bhangra Elite hosts annual Bhangra Sutra event virtually","Avery Baker","University","2021/04","https://www.dailytarheel.com/article/2021/04/arts-bhangra-sutra-2021-preview"
"As students get vaccinated, Campus and Community Advisory Committee discusses fall plans","Kameron Hall","University","2021/04","https://www.dailytarheel.com/article/2021/04/university-campus-community-advisory-committee-unc-fall-2021-plans"
"Oscars Spotlight: 'Minari' is a refreshing, heartfelt story about immigrants in America","Guillermo Molero","University","2021/04","https://www.dailytarheel.com/article/2021/04/arts-mirani-movie-review"
"A perfect match: Med students reflect on their residency 'match day' experiences","Marsalis Anderson","University","2021/04","https://www.dailytarheel.com/article/2021/04/university-school-of-medicine-match-day"
"Guskiewicz: UNC aims for a mid-July return to normal operations","Maddie Ellis","University","2021/04","https://www.dailytarheel.com/article/2021/04/university-chancellor-quanda"
"Oscars Spotlight Column: ‘Collective’ is a gripping account of truth and injustice","Ryan Phillips","University","2021/04","https://www.dailytarheel.com/article/2021/04/arts-collective-movie-review"
"LISTEN: University COVID-19 vaccine clinic & Coach Hubert Davis’ hiring","Evely Forte Praveena Somasundaram","University","2021/04","https://www.dailytarheel.com/article/2021/04/university-heel-talk-episode-41"
"'See from our perspective': Students petition chemistry department for support","Kaitlyn Dang","University","2021/04","https://www.dailytarheel.com/article/2021/04/university-chemistry-department-petition-mental-health"
"Fourth candidate for vice provost for equity and inclusion presents platform","Charlotte Geier","University","2021/04","https://www.dailytarheel.com/article/2021/04/university-vice-provost-forum-chief-diversity-officer-search-leah-cox-0407"
"Genna Rae McNeil retires from the history department after 36 years","Sophie Seoyoung Cho","University","2021/04","https://www.dailytarheel.com/article/2021/04/university-genna-rae-mcneil-feature"
"Asian American Center and Carolina Asia Center host event on improving race relations","Kaitlyn Dang","University","2021/04","https://www.dailytarheel.com/article/2021/04/university-asian-american-center-event-series"
"UNC part of national trial to study Moderna vaccine's impact on COVID-19 transmission","Natalie Johnson","University","2021/04","https://www.dailytarheel.com/article/2021/04/university-moderna-trial"
"Zooming in: Ackland student guides program engages audiences with art","Sophia Ramirez","University","2021/04","https://www.dailytarheel.com/article/2021/04/ackland-art-museum-student-guides-unc-chapel-hill"
"UNC-affiliated startup develops treatment to advance gene therapies","Emma Lindsey","University","2021/04","https://www.dailytarheel.com/article/2021/04/university-rainbio-startup"
"CAPS does not have any AAPI counselors. These students seek to change that.","Praveena Somasundaram","University","2021/04","https://www.dailytarheel.com/article/2021/04/university-asian-american-petition-aapi-counselors-caps"
"Column: When it comes to COVID-19 research, UNC is leading the charge","Rajee Ganesan","University","2021/04","https://www.dailytarheel.com/article/2021/04/opinion-covid-research-labs-unc"
"Suspect in January Campus Y vandalism incident formally arrested","Praveena Somasundaram","University","2021/04","https://www.dailytarheel.com/article/2021/04/breaking-campus-y-vandalism-arrest"
"Computer science department reverses course, suspends plan for an admissions-based system","Cynthia Dong","University","2021/04","https://www.dailytarheel.com/article/2021/04/university-cs-admissions"
"Morrison Art Studio hosts collaborative digital mural for Arts Everywhere Day","Sara Raja","University","2021/04","https://www.dailytarheel.com/article/2021/04/arts-leave-your-mark-mural-arts-everywhere"
"UNC student group Holi Moli adapts annual Holi celebration virtually","Lucy Smithwick","University","2021/04","https://www.dailytarheel.com/article/2021/04/arts-holi-celebrations-2021-holi-moli-unc"
"Study prompts investigation into impact of drinking culture on students of color","Cameron Myers Milne Malak Dridi","University","2021/04","https://www.dailytarheel.com/article/2021/04/university-alcohol-culture-impact-students-of-color"
"'Indelible legacy': UNC students reflect on Roy Williams' impact","Elizabeth Egan Madison Ward","University","2021/04","https://www.dailytarheel.com/article/2021/04/roy-williams-retirement-student-impact-unc-chapel-hill"
"Less than a year after its start, UNC group is working toward change in India","Kelly Kendall","University","2021/04","https://www.dailytarheel.com/article/2021/04/university-aid-india"
"In a step toward normalcy, UNC vaccinates its first students","Kelly Kendall","University","2021/04","https://www.dailytarheel.com/article/2021/04/university-vaccine-clinic"
"UNC and Town of Chapel Hill work together on local economic development plans","Caroline Yaffa","University","2021/04","https://www.dailytarheel.com/article/2021/04/university-economic-development-strategy"
"Editorial: Internal discipline is a recipe for disaster","Editorial Board","University","2021/04","https://www.dailytarheel.com/article/2021/04/opinion-frat-jurisdiction"
"Column: What we should actually be learning in college","Ana Sofia Thomas","University","2021/03","https://www.dailytarheel.com/article/2021/03/opinion-zoom-learning"
"No vaccine left behind: UNC Health provides surplus COVID-19 vaccines to residents","Isabella Reilly","University","2021/03","https://www.dailytarheel.com/article/2021/03/university-standby-covid-19-vaccine"
"Third finalist for UNC chief diversity officer presents in open forum","Anne Tate","University","2021/03","https://www.dailytarheel.com/article/2021/03/university-vice-provost-chief-diversity-officer-open-forum-third-finalist-virginia-hardy-0330"
"Amid a growing budget crisis, UNC names Nate Knuffman chief financial officer","Max Hazerjian","University","2021/03","https://www.dailytarheel.com/article/2021/03/university-nate-knuffman-new-chief-financial-officer"
"Column: Beverly Cleary created characters that will live on forever","Maggie Dunn","University","2021/03","https://www.dailytarheel.com/article/2021/03/arts-beverly-cleary"
"Column: In Chase Dining Hall, seating is getting a little fishy","Hannah Kaufman","University","2021/03","https://www.dailytarheel.com/article/2021/03/arts-fish-bowl-chase-dining-hall-unc-chapel"
"UNC has a brick-stealing epidemic, but this 'sidewalk savior' is fixing the holes","Susie Webb","University","2021/03","https://www.dailytarheel.com/article/2021/03/university-sidewalk-brick-replace-theft"
"In the global spotlight: UNC health care experts consider how COVID-19 has shifted research","Lauren Cook","University","2021/03","https://www.dailytarheel.com/article/2021/03/university-coronavirus-research"
"UNC set to receive 2,000 doses of the COVID-19 vaccine. But this could change.","Charlotte Geier","University","2021/03","https://www.dailytarheel.com/article/2021/03/university-unc-vaccine-clinic-details"
"Rajiv Mohabir reads century-old poetry, now translated, to mark Holi","Noah Robert Houser","University","2021/03","https://www.dailytarheel.com/article/2021/03/arts-holi-poet"
"‘If you’re going through hell, keep going': Battling Lemierre’s Syndrome","Meredith Radford","University","2021/03","https://www.dailytarheel.com/article/2021/03/lemierres-syndrome-student-feature"
"UNC students bring their light-fueled sanitization devices to the market","Max Hazerjian","University","2021/03","https://www.dailytarheel.com/article/2021/03/university-ultraloop-technologies-light-sanitization"
"Venus Standard receives award for program to train Black women to become doulas","Kennedy Rushing","University","2021/03","https://www.dailytarheel.com/article/2021/03/university-venus-standard-profile"
"UNC Board of Trustees discusses vaccinations, state budget, new statewide initiative","Elena Tsai","University","2021/03","https://www.dailytarheel.com/article/2021/03/university-bot-0325-recap"
"With increased calls to abolish Greek life, the road is far from easy","Emily Orland","University","2021/03","https://www.dailytarheel.com/article/2021/03/university-greek-life-duke-unc-solutions"
"Column: 'Tis the season for finding a computer science internship","Callie Xu","University","2021/03","https://www.dailytarheel.com/article/2021/03/opinion-cs-internship-search"
"Second finalist for UNC-CH chief diversity officer presents in open forum","Lauren McCarthy","University","2021/03","https://www.dailytarheel.com/article/2021/03/university-vice-provost-forum"
"Students, here's how to get your COVID-19 vaccine through UNC","Charlotte Geier","University","2021/03","https://www.dailytarheel.com/article/2021/03/university-unc-student-vaccine-appointments-student-union-how-to"
"Faculty Advisory Committee names nominee for secretary, discusses vaccine distribution","Samuel Garzon","University","2021/03","https://www.dailytarheel.com/article/2021/03/university-advisory-committee-0325"
"Students discuss University decision to conduct fall class registration over summer","Emma Lindsey","University","2021/03","https://www.dailytarheel.com/article/2021/03/university-late-registration-reactions"
"Editorial: Unpaid internships are a gatekeeper for underrepresented students","Editorial Board","University","2021/03","https://www.dailytarheel.com/article/2021/03/opinion-unpaid-internships"
"UNC CompostMates helps students dispose of food waste responsibly — for free","Marsalis Anderson","University","2021/03","https://www.dailytarheel.com/article/2021/03/university-compostmates-feature"
"Residence Hall Association creates award named for president Kira Griffith","Sara Raja","University","2021/03","https://www.dailytarheel.com/article/2021/03/university-residence-hall-association-award-kira-griffith"
"Editorial: Repetitive class curriculum needs to change","Editorial Board","University","2021/03","https://www.dailytarheel.com/article/2021/03/opinion-repetitive-lessons"
"Editorial: Weed-out classes shouldn't be a lesson in survival","Editorial Board","University","2021/03","https://www.dailytarheel.com/article/2021/03/opinion-hard-classes-unc-chem-102"
"UNC student grows Special Needs Special People to build a more inclusive community","Sabrina Ortiz","University","2021/03","https://www.dailytarheel.com/article/2021/03/university-amrutha-nandam-feature"
"Education majors speak out about UNC's lack of teacher licensure programs","Marin Wolf","University","2021/03","https://www.dailytarheel.com/article/2021/03/majoring-in-education-unc-teaching-license"
"Oscars Spotlight: 'Da 5 Bloods' teeters on the line between insightful and ineffectual","Guillermo Molero","University","2021/03","https://www.dailytarheel.com/article/2021/03/arts-da-5-bloods"
"UNC's search for chief diversity officer kicks off with presentation from first finalist","Hannah Rosenberger","University","2021/03","https://www.dailytarheel.com/article/2021/03/university-vice-provost-forum-rundown"
"UNC Hussman Professor Emeritus Michael Hoefges dies at 61","William Christensen","University","2021/03","https://www.dailytarheel.com/article/2021/03/university-michael-hoefges-obit-feature"
"Mental Health Awareness Week kicks off to destigmatize mental health","Lauren Cook","University","2021/03","https://www.dailytarheel.com/article/2021/03/university-mental-health-coalition"
"A tool to kill COVID-19 might be in your medicine cabinet: mouthwash","Nayeli Jaramillo-Plata","University","2021/03","https://www.dailytarheel.com/article/2021/03/university-mouthwash-trial"
"Editorial: Students, get vaccinated","Editorial Board","University","2021/03","https://www.dailytarheel.com/article/2021/03/opinion-student-covid-vaccine-guilt"
"UNC's COVID Recovery Clinic treats patients experiencing long-term symptoms","Caroline Yaffa","University","2021/03","https://www.dailytarheel.com/article/2021/03/university-post-covid-syndrome-clinic"
"UNC and Duke students work to improve access to clean water in India","Anne Tate","University","2021/03","https://www.dailytarheel.com/article/2021/03/university-healthy-hands-initiative-profile"
"Lawrence Ferlinghetti, UNC graduate and Beat poet, dies at 101","Chelsea Ramsey","University","2021/03","https://www.dailytarheel.com/article/2021/03/lawrence-ferlinghetti-obit-feature"
"After three years as DTH general manager, Erica Perel takes new job at Hussman School","Brianna Atkinson","University","2021/03","https://www.dailytarheel.com/article/2021/03/university-erica-perel-feature"
"Incoming SBP, administration work to make structural changes with Student Government","Samuel Garzon","University","2021/03","https://www.dailytarheel.com/article/2021/03/university-new-sbp-gov-restructuring"
"Oscars Spotlight Column: “Emma.” is all about aesthetics, perhaps to a fault","Guillermo Molero","University","2021/03","https://www.dailytarheel.com/article/2021/03/oscars-emma-review-aesthetics-jane-austen"
"Office DJ: Don't stop celebrating women in music next month","Madison Ward","University","2021/03","https://www.dailytarheel.com/article/2021/03/womens-history-month-playlist"
"LISTEN: UNC Law School Racist Incident & COVID-19 Vaccine Updates","Evely Forte Praveena Somasundaram Chase Taylor","University","2021/03","https://www.dailytarheel.com/article/2021/03/university-heel-talk-episode-39"
"American Indian Center director announces intention to resign","Elena Tsai","University","2021/03","https://www.dailytarheel.com/article/2021/03/university-faculty-council"
"Campus Y vigil honors victims of Atlanta shooting, supports Asian American community","Emily Orland","University","2021/03","https://www.dailytarheel.com/article/2021/03/university-campus-y-vigil"
"Mental Health Task Force discusses cost-benefit of UNC's self-help resources","Isabella Reilly","University","2021/03","https://www.dailytarheel.com/article/2021/03/unc-mental-health-task-force-meeting-0319"
"UNC looks to fill roles of Title IX coordinator, senior prevention strategy officer","Anna Neil","University","2021/03","https://www.dailytarheel.com/article/2021/03/university-title-ix-leadership-changes"
"Duke saw a major spike in COVID-19 cases. Could the same happen at UNC?","Kennedy Rushing","University","2021/03","https://www.dailytarheel.com/article/2021/03/university-unc-duke-covid-comparison"
"BOG resolution allocates potential funding for crisis management","Hannah Rosenberger","University","2021/03","https://www.dailytarheel.com/article/2021/03/university-bog-mental-health"
"Despite controversial origins, Program for Public Discourse aims to foster debate","Emma Lindsey","University","2021/03","https://www.dailytarheel.com/article/2021/03/university-public-discourse-donation"
"Editorial: Don't limit your wellness to wellness days","Editorial Board","University","2021/03","https://www.dailytarheel.com/article/2021/03/opinion-student-wellness"
"Kenan-Flagler professor hosts simulation workshop on the realities of climate change","Kaitlyn Dang","University","2021/03","https://www.dailytarheel.com/article/2021/03/university-nc-climate-workshop"
"Campus vaccine clinic to open next Wednesday with Johnson & Johnson doses","Maddie Ellis","University","2021/03","https://www.dailytarheel.com/article/2021/03/breaking-unc-vaccine-clinic-johnson-johnson"
"Tar Heel Social compiles playlists for new UNC Spotify account","Caroline Yaffa","University","2021/03","https://www.dailytarheel.com/article/2021/03/unc-chapel-hill-spotify-page"
"Amid controversy, Darrell Allison starts as chancellor of Fayetteville State University","Rachel Crumpler","University","2021/03","https://www.dailytarheel.com/article/2021/03/university-fsu-chancellor-controversy"
"UNC community issues statements of support in wake of violence against Asian Americans","Maddie Ellis","University","2021/03","https://www.dailytarheel.com/article/2021/03/university-aac-support"
"UNC increases number of health greeter kiosks around campus to encourage mask-wearing","Elena Tsai","University","2021/03","https://www.dailytarheel.com/article/2021/03/university-health-greeter-kiosks"
"Virtual slam poetry event is a sanctuary for artists of color","Lucy Smithwick","University","2021/03","https://www.dailytarheel.com/article/2021/03/arts-erot-poetry-night"
"VITAE hiring program on pause due to University budgetary constraints","Sasha Schroeder","University","2021/03","https://www.dailytarheel.com/article/2021/03/university-vitae-program-paused"
