"New Student Orientation to be held online due to novel coronavirus pandemic","Preston Fore","University","2020/04","https://www.dailytarheel.com/article/2020/04/orientation-online-0414"
"This UNC fraternity donated over $17,000 in dues to local hunger relief efforts","Lejla Brka","University","2020/04","https://www.dailytarheel.com/article/2020/04/fraternity-food-donation-0414"
"Meet the students and volunteers making face shields to donate during COVID-19","Claire Tynan","University","2020/04","https://www.dailytarheel.com/article/2020/04/students-making-masks-0414"
"UNC Campus Recreation offers online fitness classes for the campus community","Hunter Haskett","University","2020/04","https://www.dailytarheel.com/article/2020/04/exercise-classes-zoom-0410"
"'We’ve taken it in stride': Club sports teams adapt as COVID-19 cancels their seasons","Anna Neil","University","2020/04","https://www.dailytarheel.com/article/2020/04/club-sports-covid-0410"
"UNC System's Silent Sam Trust will cover Confederate group's attorney fees","Charlie McGee","University","2020/04","https://www.dailytarheel.com/article/2020/04/unc-silent-sam-trust-payments-approved"
"'It’s really fitting': Seniors dedicate week of kindness to memory of Wynn Burrus","Sara Raja","University","2020/04","https://www.dailytarheel.com/article/2020/04/wynn-burrus-virtual-remembrance-0409"
"On-campus robberies follow COVID-19-related closures","Rachel Crumpler","University","2020/04","https://www.dailytarheel.com/article/2020/04/campus-robberies-0409"
"Students are fostering and adopting pets during social distancing","Greta Travaglia","University","2020/04","https://www.dailytarheel.com/article/2020/04/animal-adoptions-0408"
"Meet the UNC law professor who went viral for bringing a doll to his empty lecture","Anthony Howard","University","2020/04","https://www.dailytarheel.com/article/2020/04/professor-teaching-doll-viral-0408"
"'Re-establish what we had': UNC religious groups connect with students despite COVID-19","Dylan Morgan","University","2020/04","https://www.dailytarheel.com/article/2020/04/students-celebrating-religion-0408"
"Some at UNC have privacy, data security concerns with using Zoom platform for learning","Hannah McClellan","University","2020/04","https://www.dailytarheel.com/article/2020/04/zoom-cybersecurity-questions-unc-usage"
"UNC's dentistry school rolls out virtual care amid stay-at-home order","Lauren Cook","University","2020/04","https://www.dailytarheel.com/article/2020/04/dentistry-coronavirus-0407"
"'An immersive experience': Professor uses virtual reality to replicate the classroom","Lejla Brka","University","2020/04","https://www.dailytarheel.com/article/2020/04/virtual-reality-classroom-0407"
"As online exams approach, UNC community members offer advice, recognize compromise need","Allie Kelly","University","2020/04","https://www.dailytarheel.com/article/2020/04/exams-at-home-0407"
"UNC Health receives PPE donations from the community as COVID-19 strains hospitals","Maydha Devarajan","University","2020/04","https://www.dailytarheel.com/article/2020/04/ppe-donations-0407"
"UNC graduate sisters fundraise, team with local restaurants to feed health care workers","Chiara Evans","University","2020/04","https://www.dailytarheel.com/article/2020/04/feed-the-fight-0407"
"UNC Police investigating on-campus burglaries at Rams Village","Hannah Lang","University","2020/04","https://www.dailytarheel.com/article/2020/04/rams-burglaries-0406"
"'In the language of students': Online hub connects students to resources during COVID-19","Nicole Moorefield","University","2020/04","https://www.dailytarheel.com/article/2020/04/student-care-hub-0406"
"Reduced hours and online operation: A new reality for UNC work-study students","Macy Meyer","University","2020/04","https://www.dailytarheel.com/article/2020/04/work-study-coronavirus-0406"
"Nursing school waives tuition and fees for course to help nurses respond to COVID-19","Anna Neil","University","2020/04","https://www.dailytarheel.com/article/2020/04/free-nursing-program-0402"
"Career plans upended because of COVID-19? We talked with UCS about what to do next","Katie Clark","University","2020/04","https://www.dailytarheel.com/article/2020/04/covid-career-quanda-0402"
"About to register for Gen Eds? Consider learning about puppets!","A.J. OLeary","University","2020/04","https://www.dailytarheel.com/article/2020/04/puppetry-class-0403"
"UNC summer school will be online, College of Arts & Sciences to offer pass/fail option","Maeve Sheehey","University","2020/04","https://www.dailytarheel.com/article/2020/04/summer-school-online-0402"
"Campus Health allows students to receive telehealth services remotely","Dylan Morgan","University","2020/04","https://www.dailytarheel.com/article/2020/04/campus-health-telemedicine-0402"
"Here's what you missed at the latest Campus Safety Commission meeting","Sasha Schroeder","University","2020/04","https://www.dailytarheel.com/article/2020/04/campus-safety-commission-401"
"'I've heard all the stereotypes': Students, alumni respond to COVID-19-related racism","Ramishah Maruf","University","2020/04","https://www.dailytarheel.com/article/2020/04/racism-coronavirus-0402"
"Here's how students are navigating the tricky world of group projects online","Sara Raja","University","2020/04","https://www.dailytarheel.com/article/2020/04/social-distancing-group-projects-0402"
"Here's how Carolina Cupboard is feeding students amid the pandemic","Nicole Moorefield","University","2020/04","https://www.dailytarheel.com/article/2020/04/carolina-cupboard-covid-action-0401"
"Thousands sign petition with demands regarding UNC System response to COVID-19","Sasha Schroeder","University","2020/04","https://www.dailytarheel.com/article/2020/04/petition-system-workers-040"
"Academic Advising goes virtual: How to make an appointment","Isabella Sherk","University","2020/04","https://www.dailytarheel.com/article/2020/04/remote-advising-0401"
"Here's how loosened admission requirements affect UNC System applicants","Emily Orland","University","2020/03","https://www.dailytarheel.com/article/2020/03/new-sat-policy-0401"
"'I kind of needed something to do': Picking up new hobbies during social distancing","Olivia Rojas","University","2020/03","https://www.dailytarheel.com/article/2020/03/quarantine-hobbies-0401"
"After first being terminated effective April 1, UNC RAs will be paid through April 30","Maddie Ellis","University","2020/03","https://www.dailytarheel.com/article/2020/03/ra-paid-update-0401"
"'Roller coaster of emotions': How UNC students and faculty got stranded in Guatemala","Preston Fore","University","2020/03","https://www.dailytarheel.com/article/2020/03/students-stranded-0401"
"Animal Crossing allows students to fish, frolic and build community away from campus","Evan Castillo","University","2020/03","https://www.dailytarheel.com/article/2020/03/animal-crossing-033"
"Despite pandemic, Carolina Center for Public Service says students can still volunteer","Chiara Evans","University","2020/03","https://www.dailytarheel.com/article/2020/03/ccps-volunteering-coronavirus-0330"
"Meet the finalists for UNC's next Vice Chancellor for Student Affairs","Dylan Morgan","University","2020/03","https://www.dailytarheel.com/article/2020/03/vcsa-search-0331"
"Here's how UNC's Writing and Learning Centers are helping students remotely","Kate Carroll","University","2020/03","https://www.dailytarheel.com/article/2020/03/learning-center-online-0330"
"Here's how UNC's political groups are staying active while campus is shut down","Sara Raja","University","2020/03","https://www.dailytarheel.com/article/2020/03/political-groups-coronavirus-0330"
"Here's how COVID-19 changed life in the University and state over the course of a month","Maeve Sheehey Michael Taffe","University","2020/03","https://www.dailytarheel.com/article/2020/03/covid-timeline-0331"
"UNC System plans to refund students for unused housing and meal plans","Maeve Sheehey","University","2020/03","https://www.dailytarheel.com/article/2020/03/unc-system-refunds-0330"
"Carolina Women in Business strives to achieve gender equality in the professional world","Alexis Dumain","University","2020/03","https://www.dailytarheel.com/article/2020/03/women-in-business-0330"
"'Something for us and by us': The Bridge seeks to uplift women of color","Praveena Somasundaram","University","2020/03","https://www.dailytarheel.com/article/2020/03/bridge-feature-0330"
"DTH City & State Editor Anna Pogarcic chosen to be 2020-21 editor-in-chief","Hannah Lang","University","2020/03","https://www.dailytarheel.com/article/2020/03/anna-pogarcic-new-editor-in-chief-0330"
"These campus and local groups are seeking to provide education on sexual violence","Allie Kelly","University","2020/03","https://www.dailytarheel.com/article/2020/03/sexual-assault-progress-0330"
"'Rats and Rouge': The story behind Spencer Hall, UNC's first residence hall for women","Sara Raja","University","2020/03","https://www.dailytarheel.com/article/2020/03/spencer-hall-0330"
"Here's what happened at the Board of Trustees' (virtual) Thursday meeting","Lauren Cook","University","2020/03","https://www.dailytarheel.com/article/2020/03/virtual-board-of-trustees-0327"
"'A holding pattern': Here's how student government is adjusting to reduced operations","Hunter Haskett","University","2020/03","https://www.dailytarheel.com/article/2020/03/student-government-coronavirus-0327"
"UNC researchers are using virtual reality to help detect multiple sclerosis earlier","Katie Clark","University","2020/03","https://www.dailytarheel.com/article/2020/03/virtual-reality-ms-0327"
"UNC students connect health care workers with emergency child care amid pandemic","Claire Tynan","University","2020/03","https://www.dailytarheel.com/article/2020/03/gillings-healthcare-website-0327"
"UNC Makerspaces are helping fight against medical supply shortages due to COVID-19","Emily Orland","University","2020/03","https://www.dailytarheel.com/article/2020/03/beam-equipment-covid-0327"
"Everywhere you look: Here's how students are handling virtual class in a full house","Greta Travaglia","University","2020/03","https://www.dailytarheel.com/article/2020/03/students-big-family-zoom-classes-0327"
"UNC's $2.5 million Confederate payout won't be fully repaid despite backdoor deal reversal","Charlie McGee","University","2020/03","https://www.dailytarheel.com/article/2020/03/silent-sam-trust-funds-unreturned"
"UNC's Eshelman School of Pharmacy to offer online master's program","Olivia Rojas","University","2020/03","https://www.dailytarheel.com/article/2020/03/new-online-two-year-pharmacy-degree-0326"
"Carolina Student Impact Fund helps students struggling due to COVID-19","Evan Castillo","University","2020/03","https://www.dailytarheel.com/article/2020/03/student-impact-fund-0325"
"Hundreds co-sign letter asking UNC to pay campus RAs through the semester","Maddie Ellis","University","2020/03","https://www.dailytarheel.com/article/2020/03/ra-response-coronavirus-carolina-housing-compensation-letter-0325"
"Here's how different courses adjusted for the first days of online classes","Alexis Dumain","University","2020/03","https://www.dailytarheel.com/article/2020/03/first-day-online-classes-0324"
"Sororities and fraternities share how they are supporting members during the pandemic","Sasha Schroeder","University","2020/03","https://www.dailytarheel.com/article/2020/03/greek-houses-adapt-to-coronavirus-0323"
"UNC professor's syllabus went viral as classes move online amid coronavirus outbreak","Emily Holler","University","2020/03","https://www.dailytarheel.com/article/2020/03/adjusted-syllabus-coronavirus-0324"
"Students grapple with whether to see immunocompromised family during COVID-19 outbreak","Praveena Somasundaram","University","2020/03","https://www.dailytarheel.com/article/2020/03/students-with-immunocompromised-family-members-coronavirus-0324"
"'Just talk to somebody': UNC students call local senior citizens during quarantine","Allie Kelly","University","2020/03","https://www.dailytarheel.com/article/2020/03/unc-students-call-nursing-homes-phone-a-friend-0324"
"'What does this mean for us?': RAs and other student employees feel COVID-19's impact","Maddie Ellis","University","2020/03","https://www.dailytarheel.com/article/2020/03/students-residence-advisers-lose-campus-jobs-covid-0323"
"We talked to a UNC student who tested positive about what it's like to have COVID-19","Maeve Sheehey","University","2020/03","https://www.dailytarheel.com/article/2020/03/unc-study-abroad-student-tested-positive-covid-19-quanda-0323"
"'A very unusual time': Board of Governors discussed system response to COVID-19","Praveena Somasundaram","University","2020/03","https://www.dailytarheel.com/article/2020/03/board-of-governors-coronavirus-response-0323"
"Here's what professors want you to know about the switch to online learning","Kaitlyn Boeckel","University","2020/03","https://www.dailytarheel.com/article/2020/03/what-unc-professors-want-you-to-know-about-online-classes0323"
"Moving out months early presents challenges for on-campus students","Claire Tynan","University","2020/03","https://www.dailytarheel.com/article/2020/03/students-move-out-of-dorms-months-early-unc-0323"
"'I'm sad to go out like this': For seniors, COVID-19 brings the premature end of an era","Bill Cozens","University","2020/03","https://www.dailytarheel.com/article/2020/03/seniors-graduating-cut-short-commencement-postponed-covid"
"Limited Carolina Dining Services operations affect students with meal plans","Greta Travaglia","University","2020/03","https://www.dailytarheel.com/article/2020/03/dining-halls-closing-affecting-students-meal-plans-0323"
"Here's how students are keeping up friendships now that campus is closed","Anna Neil","University","2020/03","https://www.dailytarheel.com/article/2020/03/quarantine-friendships-0320"
"UNC offers a pass/fail option for students, suspends spring 2020 Dean's List","Maeve Sheehey","University","2020/03","https://www.dailytarheel.com/article/2020/03/pass-fail-suspended-deans-list-cv-grade-not-incomplete-coronavirus-0320"
"UNC's Spring Commencement postponed due to COVID-19","Praveena Somasundaram","University","2020/03","https://www.dailytarheel.com/article/2020/03/unc-spring-commencement-postponed-due-to-coronavirus0320"
"UNC Hospitals develops COVID-19 testing kits, responds to pandemic","Allie Kelly","University","2020/03","https://www.dailytarheel.com/article/2020/03/covid-testing-0320"
"Robertson scholarship selection weekend canceled due to COVID-19","Rachel Crumpler","University","2020/03","https://www.dailytarheel.com/article/2020/03/robertson-scholarship-canceled-due-to-coronavirus-0320"
"'It is uncharted territory': Maintaining mental health during social distancing","Maydha Devarajan","University","2020/03","https://www.dailytarheel.com/article/2020/03/social-distancing-mental-health-0319"
"Students are petitioning the University for a pass/fail option this semester","Evely Forte","University","2020/03","https://www.dailytarheel.com/article/2020/03/petition-pass-fail-spring-0319"
"Pandemic 101: What an infectious disease expert wants you to know about COVID-19","Hannah Lang","University","2020/03","https://www.dailytarheel.com/article/2020/03/pandemic-quanda-0319"
"UNC urges students who live off-campus to return to their permanent addresses","Maeve Sheehey","University","2020/03","https://www.dailytarheel.com/article/2020/03/off-campus-students-asked-to-return-home-to-permanent-address"
"University will only permit critical research activities in labs until at least March 31","Maeve Sheehey","University","2020/03","https://www.dailytarheel.com/article/2020/03/research-guidelines-covid-0318"
"UNC Dance Marathon to be hosted virtually following campus event suspensions","Isabella Sherk","University","2020/03","https://www.dailytarheel.com/article/2020/03/cftk-virtual-marathon-0318"
"Coronavirus closures complicate move-out process for many UNC students","Praveena Somasundaram","University","2020/03","https://www.dailytarheel.com/article/2020/03/move-out-decision-0318"
"UNC will close residence halls for the academic year, move to reduced operations","Maeve Sheehey","University","2020/03","https://www.dailytarheel.com/article/2020/03/unc-reduced-operations"
"UNC employee tests presumptively positive for COVID-19","Maeve Sheehey","University","2020/03","https://www.dailytarheel.com/article/2020/03/unc-test-positive-0317"
"UNC System: On-campus students must leave residence halls unless given an exception","Maeve Sheehey","University","2020/03","https://www.dailytarheel.com/article/2020/03/campus-housing-exceptions"
"102 years ago, the Spanish flu hit campus. What can it teach us about pandemics?","Bill Cozens","University","2020/03","https://www.dailytarheel.com/article/2020/03/spanish-flu-1918-0317"
"Here's what you need to know about campus after UNC's COVID-19 response","Maeve Sheehey","University","2020/03","https://www.dailytarheel.com/article/2020/03/post-spring-break-faq-0317"
"From jazz to LFIT, UNC professors plan how they'll take their classes online next week","Allie Kelly","University","2020/03","https://www.dailytarheel.com/article/2020/03/professors-make-online-learning-transition-0317"
"Study abroad students look for University guidance following travel restrictions","Evely Forte","University","2020/03","https://www.dailytarheel.com/article/2020/03/coronavirus-abroad-reactions-0316"
"UNC researchers are renewing a partnership with this company to find a cure for HIV","Rachel Crumpler","University","2020/03","https://www.dailytarheel.com/article/2020/03/hiv-healthcare-partnership-0316"
"We sat down with Chancellor Guskiewicz to talk coronavirus, the Clery Act and more","Maeve Sheehey","University","2020/03","https://www.dailytarheel.com/article/2020/03/chancellor-kevin-guskiewicz-quanda-clery-act-coronavirus-silent-sam-salaries"
"UNC cancels all spring 2020 study abroad programs","Maeve Sheehey","University","2020/03","https://www.dailytarheel.com/article/2020/03/study-abroad-programs-canceled"
"Summer study abroad programs through UNC canceled","Maeve Sheehey","University","2020/03","https://www.dailytarheel.com/article/2020/03/summer-study-abroad-cancellled"
"UNC to extend spring break, begin remote instruction March 23","Maeve Sheehey","University","2020/03","https://www.dailytarheel.com/article/2020/03/unc-to-extend-spring-break-by-a-week-begin-remote-classes-march-23-indefinitely"
"Hillel hosts experts to speak on Israeli-Palestinian Negotiations","Hunter Haskett","University","2020/03","https://www.dailytarheel.com/article/2020/03/hillel-event-0306"
"Demonstrators gather, give out baked goods to oppose planned Confederate protest","Hannah Lang","University","2020/03","https://www.dailytarheel.com/article/2020/03/peaceandjustice-demonstration-0307"
"Two female students report inappropriate touching in Hanes Art Center","Maeve Sheehey","University","2020/03","https://www.dailytarheel.com/article/2020/03/alert-carolina-inappropriate-touching-0306"
"Campus Y leader's sudden dismissal opens potential for more UNC control","Eva Ellenburg","University","2020/03","https://www.dailytarheel.com/article/2020/03/campus-y-harrill-firing-questions"
"Law students to spend spring break giving back through free legal services","A.J. OLeary","University","2020/03","https://www.dailytarheel.com/article/2020/03/pro-bono-program-0306"
"Faculty Athletics Committee talks coronavirus, faculty engagement","Anna Neil","University","2020/03","https://www.dailytarheel.com/article/2020/03/faculty-athletics-0306"
"What you need to know about UNC's coronavirus travel policy before spring break","Maeve Sheehey","University","2020/03","https://www.dailytarheel.com/article/2020/03/coronavirus-faq-0306"
"'I thought they were overreacting': Students plan spring break around coronavirus","Stephanie Mayer","University","2020/03","https://www.dailytarheel.com/article/2020/03/coronavirus-spring-break-0306"
"UNC to introduce credit-based registration model for spring 2021","Ramishah Maruf","University","2020/03","https://www.dailytarheel.com/article/2020/03/registration-system-0306"
"Meet the students behind the Pit protests addressing voting rights","Addison Skigen","University","2020/03","https://www.dailytarheel.com/article/2020/03/pit-protests-0305"
"'On everyone's mind': Data shows UNC faculty salaries fall behind peer universities","Preston Fore","University","2020/03","https://www.dailytarheel.com/article/2020/03/faculty-salaries-030"
"Students returning from coronavirus-afflicted nations may be asked to self-quarantine","Maeve Sheehey","University","2020/03","https://www.dailytarheel.com/article/2020/03/coronavirus-quarantine-0304"
"Dean Susan King will gift administration award money to Hussman students","Katie Clark","University","2020/03","https://www.dailytarheel.com/article/2020/03/dean-king-award-0305"
"Here's a list of UNC programs impacted by coronavirus","Chiara Evans","University","2020/03","https://www.dailytarheel.com/article/2020/03/coronavirus-campus-cancellations-0304"
"'The biggest difference is avocados': Fraternity and sorority eating at UNC","Addison Skigen","University","2020/03","https://www.dailytarheel.com/article/2020/03/greek-eats-0221"
"UNC's Undergraduate Senate to vote on making senate seats paid","Preston Fore","University","2020/03","https://www.dailytarheel.com/article/2020/03/senate-bill-0305"
"'Increasingly disturbing': Campus Safety Commission discusses anti-Semitism at UNC","Jessica Mastor","University","2020/03","https://www.dailytarheel.com/article/2020/03/campus-safety-0305"
"Commission discussed the future of the sinking Unsung Founders Memorial","Maydha Devarajan","University","2020/03","https://www.dailytarheel.com/article/2020/03/commision-history-race-0304"
"Students abroad plan next steps after program cancellations due to coronavirus","Rachel Crumpler","University","2020/03","https://www.dailytarheel.com/article/2020/03/coronavirus-study-abroad-update-0304"
"'Grateful and humbled': UNC senior to spend a year in Asia as a Luce Scholar","Madeline Pennington","University","2020/03","https://www.dailytarheel.com/article/2020/03/wesley-price-0304"
"Two UNC students buy and sell designer clothes to make money and show off their style","Nathan Wesley","University","2020/03","https://www.dailytarheel.com/article/2020/03/shoe-sales-0303"
"Staying in Chapel Hill over break? Here's what you need to know","Dylan Morgan","University","2020/03","https://www.dailytarheel.com/article/2020/03/spring-break-guide-0303"
"Sunrise Movement is taking grassroots action on climate change at UNC and beyond","Anna Southwell","University","2020/03","https://www.dailytarheel.com/article/2020/03/sunrise-movement-0303"
"These Tar Heels didn't wait to graduate UNC to become published authors","Suzanne Blake","University","2020/03","https://www.dailytarheel.com/article/2020/03/student-authors-0226"
"Students 'ice-skated' on campus at CUAB hosted event","Kaitlyn Boeckel","University","2020/03","https://www.dailytarheel.com/article/2020/03/heels-on-ice-0302"
"'The astonished war': Panel discusses voter suppression in North Carolina","Kate Carroll","University","2020/03","https://www.dailytarheel.com/article/2020/03/voter-suppression-panel-0302"
"‘Midnight and graves and weirdness’: Order of Gimghoul’s initiation rituals uncovered","Sasha Schroeder","University","2020/03","https://www.dailytarheel.com/article/2020/03/gimghoul-initiation-0302"
"Students note the challenges of medical school debt and look toward tuition options","Maydha Devarajan","University","2020/03","https://www.dailytarheel.com/article/2020/03/medical-school-tuition-0225"
"'Competing with myself': Rock climbing club gives students a niche on campus","Noah Dolgoff","University","2020/03","https://www.dailytarheel.com/article/2020/03/rock-climbing-0302"
"Annual Women's Day Tea discussed gender inequality in the 21st century","Olivia Rojas","University","2020/03","https://www.dailytarheel.com/article/2020/03/women-day-tea-0302"
"Former Ancestry CEO and documentary filmmaker give 2020 Eve Carson Lecture","Stephanie Mayer","University","2020/03","https://www.dailytarheel.com/article/2020/03/eve-carson-lecturers-0227"
"UNC cancels spring study abroad programs to Italy due to coronavirus","Maeve Sheehey","University","2020/03","https://www.dailytarheel.com/article/2020/03/coronavirus-study-abroad-0229"
"Coronavirus affects UNC students studying abroad in Italy","Claire Tynan","University","2020/03","https://www.dailytarheel.com/article/2020/03/coronavirus-italy-0228"
"Black Business Student Association talks ways to improve diversity at Kenan-Flagler","Katie Clark","University","2020/02","https://www.dailytarheel.com/article/2020/02/race-allyship-kenan-flagler-0227"
"Terry Rhodes named dean of the College of Arts and Sciences","Maeve Sheehey","University","2020/02","https://www.dailytarheel.com/article/2020/02/terry-rhodes-dean-0228"
"Wilson Library showcases the work of specialized state newspapers","Anna Neil","University","2020/02","https://www.dailytarheel.com/article/2020/02/wilson-newspapers-0227"
"'She really understands students': Meet UNC's interim chief diversity officer","Evan Castillo","University","2020/02","https://www.dailytarheel.com/article/2020/02/chief-diversity-officer-0228"
"Don't let midterms get you down — here's how to prioritize your mental health","Emily Orland","University","2020/02","https://www.dailytarheel.com/article/2020/02/midterms-mental-health-quanda-0227"
"This art class is taking it back a few centuries with printing presses","A.J. OLeary","University","2020/02","https://www.dailytarheel.com/article/2020/02/letterpress-class-0227"
"Here's how Carolina For The Kids is trying to raise $60k in one day","Madeline Pennington","University","2020/02","https://www.dailytarheel.com/article/2020/02/one-day-campaign-0226"
